annotation_approver,comment_count,created_at,id,label,text,updated_at,user
,0,2021-03-24T10:38:35.316171Z,1017,5,"planning can have a negative effect upon rural life and service .get the economy move be the positive way of help rural community .planning and bureaucracy have a negative effect upon those community and their service .I see two strand of planning .the first seek to provide service for present and forecast population .that strand exercise a negative control on development .on the other hand planning can play a positive role in attempt to decide the future need of a particular area .I be concerned that too many authority be plan too rigidly for their area and in that context , many of they will become unstuck .",2021-03-24T10:38:35.316213Z,1
,0,2021-03-23T13:48:53.355190Z,1018,1,"under the Bill , without new clause 6 , which I sincerely hope we shall not pass , we have for the first time innovatory legislation which allow entrepreneur to do just that .many of we have in our constituency entrepreneur who have already battle through the lengthy process of argue with the establish bureaucracy of the National Bus Company , the passenger transport executive and the local authority in order to get their service go .they be already provide service .in Committee I give three example from my own constituency where they be provide excellent service where the institutionalised public provision would just not succeed .I therefore urge the House to reject the new clause .",2021-03-23T13:48:53.355327Z,1
,0,2021-03-23T14:12:41.669697Z,1019,5,"therefore , clause 7 be welcome , because it reduce the burden on small firm and it align the two - year qualifying period for redundancy with the two - year qualifying period for unfair dismissal .however , there be one problem .when one look at the clause in detail , it be clear that whoever draft it — I be sure that it be not one of my right hon .or hon .friend , but perhaps it be someone in the Department — have no experience of small business or small business man .if he have , he would never have include para - graphp ( c ) , which state : the dismiss employee be on be engage inform in writing of the effect of this section .that undermine the purpose of the clause — which be to relieve small business man of bureaucracy .small business man neither understand it , nor do they want to undertake the administration .the last thing that a small business man want be to get involve in paperwork .many will never have read the regulation , and in practice they will not give their employee notice of this part of the law in writing when they be first employ .many never get round to give contract of employment until they be challenge .I suggest that member of Parliament should consider their position as small employer .how many hon .member give their secretary contract of employment ?I trust that any hon .member who have not do so will be prepare to vote for this amendment tonight .",2021-03-23T14:12:41.669735Z,1
,0,2021-03-23T13:48:57.570384Z,1020,1,"may I draw my hon .friend 's attention to two recent example of behaviour by the community relation council ?be he aware of the violent and offensive attack by the Northampton community relation council on my hon .friend the Member for Northampton , North ( Mr. Marlow)—an attack which would be proper in a political party but which be grossly improper in a non - political bureaucracy ?secondly , be my hon .friend aware of the refusal by the Wolverhampton community relation council to accept the advice of the Commission for Racial Equality on the appointment of an official ?do not those two example point to the proposition that the community relation council should be directly responsible either to the Home Office or to local authority ?",2021-03-23T13:48:57.570433Z,1
,0,2021-03-24T10:12:58.773706Z,1021,1,"it be clear that the decision to abolish the Trust be one of stupid bureaucracy .it be be do because of party political dogma .it be a decision that do not take note of the special problem in Northern Ireland .it be a decision that will exacerbate unemployment in the Province , because job in food processing , packaging and marketing will go elsewhere .they will be lose to other country .let the Government remember that 75 per cent .of Ulster farmer depend upon export sale .therefore the decision to axe the Trust will have an adverse effect not only on the agricultural community but on the entire Ulster economy .",2021-03-24T10:12:58.773864Z,1
,0,2021-03-23T13:49:03.306974Z,1022,5,"the case for the right to buy have never be put more succinctly or cogently than in a pamphlet publish a few year ago .it state : there seem to I to be three immensely important advantage .in the first place it would be a massive redistribution of wealth in our community .secondly , it would extend the new dimension of individual freedom to a large number of people : freedom from the petty rule and restriction impose by bureaucracy , and also freedom in the ability to move around the country .thirdly … this approach would be a direct attack on the cycle of poverty in that we would for the first time be give many poor people that crucial thing they lack — and that be access to wealth .that be not say by a Conservative Member .it be write by a Member of the Labour Party , namely , the hon .member for Birkenhead ( Mr. Field ) .in those few word , he speak more sense on the sale of council house than we have hear from the Labour Party throughout our proceeding .",2021-03-23T13:49:03.307036Z,1
,0,2021-03-23T14:12:49.171197Z,1023,4,do my right hon .friend agree that that demonstrate the outstanding popularity of the Government 's policy in sell public housing ?will he do everything in his power to ensure that those who wish to buy be not hold up by bureaucracy and socialist dogma ?,2021-03-23T14:12:49.171254Z,1
,0,2021-03-23T13:49:14.411417Z,1024,5,"it be absurd to bring the rigid bureaucracy of the Act to bear on authority with only a few employee engage in this work .the amendment will do no harm to the principle that the Government wish to establish .in a typical metropolitan authority , contract with a combine value of £ 16 million a year will be over £ 250,000 each , compare with an overall budget on new work of £ 20 million .the limit of £ 250,000 clearly allow sufficient work to go out to competitive tender .the exclusion of authority with few than 100 employee would not damage the principle of competitive tendering which the Government be try to establish .",2021-03-23T13:49:14.411457Z,1
,0,2021-03-24T10:32:11.701530Z,1025,5,"the Government have claim at various time that local authority should be locally control and that there should be less bureaucracy , less red tape and less outside interference .but the clause that we be consider provide for exactly the opposite .",2021-03-24T10:32:11.701568Z,1
,0,2021-03-23T13:49:21.860483Z,1026,6,"I do not believe that there be any justification for the clause , even from the Government side , except as a gift to private contractor .that be the motivation behind their introduction .many private contractor have suffer enormously from reduction in public expenditure force on local authority by the Government .in the new town , large contractor have do very well as a result of the large public scheme that have be conceive by previous government , but which the present Government be not prepared to countenance .the bureaucracy to which these clause will give rise will increase the cost to the public without any advantage to those who foot the bill .I do not see that there be any reasonable argument for place restriction on efficient direct work organisation .",2021-03-23T13:49:21.860547Z,1
,0,2021-03-23T14:12:55.898033Z,1027,7,"I take the point make by my hon .friend the Member for Somerset , North ( Mr. Dean ) about bureaucracy and accountability .what I shall say about the final amendment will please he in relation to the small dlo .we be satisfied that in our negotiation with the cipfa we shall find a simple procedure which will not involve the increase in staff of which some people be fearful .",2021-03-23T14:12:55.898079Z,1
,0,2021-03-24T10:13:07.575770Z,1028,5,"finally , may I say that I can not remember any matter that have create strong opposition from local council .it be particularly astonishing , because local authority like bureaucracy , yet here be an item of bureaucracy that would help to expand the empire of some local government officer , and they do not want it .may I read from a letter which Mr. James Lightdown , the chairman of the Staffordshire education authority write to I —",2021-03-24T10:13:07.575856Z,1
,0,2021-03-23T13:50:47.241237Z,1029,3,"the system that the Government have propose will also cause unnecessary bureaucracy in have people assess all the time the annual box - in requirement for each particular year .so again , another object of central Government , the reduction of manpower of local authority , and particularly manpower do needless bureaucratic job , would be infringe by part VIII , which be totally unnecessary with the present system of working .",2021-03-23T13:50:47.241294Z,1
,0,2021-03-23T14:13:04.344368Z,1030,1,"in this Green Paper the Government be move part of the public bureaucracy , namely , that in respect of payment of sickness benefit , to the private sector — private bureaucracy , in other word — where there will be no possibility of measure the scale .the problem will not go away .the benefit will still have to be pay .there will still be problem of the number of day , waiting day , and so on .it be no good the Minister for Social Security shake his head .he will have to take cognisance of this in the consultation that he be undertake .",2021-03-23T14:13:04.344397Z,1
,0,2021-03-23T13:50:53.754983Z,1031,1,"perhaps I might just make this point , because I want to give way to the Liberal spokesman .it be the Liberal Party 's debate , and a Liberal Member will be wind up the debate .I want to make this last quotation : by spread the administrative burden amongst numerous employer it become impossible to see or discover the size of the private sector bureaucracy .there be no way out of that .",2021-03-23T13:50:53.755044Z,1
,0,2021-03-24T10:36:45.780952Z,1032,2,"there still be the idea — we have have echo of it in the debate — of a community where power be concentrate on an ambitious bureaucracy with creep competence , as the hon .Member for Waltham Forest ( Mr. Deakins ) say , a community dominate by farm lobby and a community which admit Britain only to humiliate and exploit we .",2021-03-24T10:36:45.780983Z,1
,0,2021-03-23T13:51:01.800015Z,1033,1,"the new arrangement be base on recommendation result from a study of the administration of the current scheme make in consultation with Sir Derek Rayner .they be design to reduce bureaucracy , cut the number of form that farmer have to fill up , generally speed up the whole process and leave farmer with more responsibility for their own investment decision .",2021-03-23T13:51:01.800068Z,1
,0,2021-03-23T14:13:11.897037Z,1034,1,"the new interface between farmer and the national park may make it more difficult for the park to improve their relationship with the farming community .decision that might have seem acceptable if they have come from the ADAS representative may seem less acceptable to farmer when they come from the national park .farmer may be more inclined to challenge decision from the national park than from ADAS representative .that be a problem , but it should not prove to be insurmountable .to what extent be the effect of the regulation in the national park simply to transfer manpower requirement from the Ministry of Agriculture , Fisheries and Food to the national park bureaucracy ?can my hon .friend give the House an assurance that there will be no requirement to increase manpower in the Peak District national park as a result of the new obligation that the regulation place upon the national park ?",2021-03-23T14:13:11.897069Z,1
,0,2021-03-23T13:51:05.426661Z,1035,1,"I emphasise again that the purpose of the scheme be advice , not bureaucracy .I commend it to the House .",2021-03-23T13:51:05.426726Z,1
,0,2021-03-24T10:13:17.113298Z,1036,1,"I should like the House to consider the following .Britain 's training system for produce the skilled manpower require for a modern and competitive manufacturing base be still the bad in the West .the Industrial Training Act 1964 and the revision of 1973 have in no way solve the problem .we now have a sizeable training bureaucracy , and we have considerable effort devote to training by employer , trade union and Government official .but there continue to be serious complaint about skill shortage and the failure of the training system to respond adequately to industry 's change need .much of the argument in term of industry 's problem be the fact that we have not be responsive to the change need of consumer both in this country and abroad .",2021-03-24T10:13:17.113362Z,1
,0,2021-03-23T13:51:33.310188Z,1037,1,"as the EEC draft directive on product liability , which we shall discuss next week , be cause a great amount of concern and worry in commerce and industry , as it will massively increase cost and bureaucracy , can my right hon .friend tell the House what action can be take on Tuesday to prevent the thing from ever see the light of day ?when he reply I would be grateful if he do not say something about harmonisation be important to our industry , at a time when european food and the budget effectively cost every industrial worker in this country £ 2 a week .",2021-03-23T13:51:33.310259Z,1
,0,2021-03-23T14:13:21.956137Z,1038,1,"staunch democrat and parliamentarian that I be , I be not so concerned about the Commission and its bureaucracy .it be not vast but be an open , accessible bureaucracy .one can talk to civil servant in the Commission .I go there quite often .the institution that I would criticise a little be the European Parliament .I never know where to find it .be it in Strasbourg , Luxembourg or perhaps Brussels ?it be rather expensive to run .I hear on the radio this morning that someone have calculate that it cost about £ 320,000 per Member .can that be right ?it seem an exceptional amount — not that the member be pay that much each .",2021-03-23T14:13:21.956175Z,1
,0,2021-03-24T10:32:16.030558Z,1039,6,"do the Minister agree with the National Union of Students and the Association of University Teachers that any system of loan involve a costly bureaucracy and discourage work class child from go to college ?will be stop waste Government time and money in look at a loan scheme , stop cause alarm and despondency among intend student , and rule it out now , once and for all ?",2021-03-24T10:32:16.030620Z,1
,0,2021-03-23T14:13:33.187579Z,1040,2,"we must find way of bring into the discussion those involve in the various energy industry .I be against bureaucracy , wherever it may exist .I have no wish — as seem to have be argue — to set up a bureaucratic pimple on the body politic .nevertheless , open discussion of this subject be vital .",2021-03-23T14:13:33.187621Z,1
,0,2021-03-24T10:13:22.435455Z,1041,1,I be not blame the Home Office official .the Minister 's own official be exceedingly helpful and I give they credit for it .but they know that they be overburden and will not be able to deal with this additional burden unless there be a vast increase in the bureaucracy .,2021-03-24T10:13:22.435499Z,1
,0,2021-03-23T14:13:41.863746Z,1042,2,"the hon .Gentleman express a fairly widely hold view , but all the power hold by the scottish and Welsh Development Agencies respectively be hold , though by different agency , in the North .to add an agency on the line of the scottish or Welsh Development Agency for the North would not provide a single extra power but would provide an extra unit of bureaucracy which would confuse rather than increase the prospect for the North .",2021-03-23T14:13:41.863794Z,1
,0,2021-03-24T10:44:51.411429Z,1043,2,"if the hon .Gentleman will be patient , I shall refer in the course of my speech to what the Bill do for parental involvement and participation .as my right hon .friend the Secretary of State say , this be a progressive measure .in a sense , for the first time in many year , it take scottish education out of the crystallised cobweb of bureaucracy in which it have be stick for far too long .most important of all — I shall explain why in a moment — the Bill bring the parent back into the educational picture .",2021-03-24T10:44:51.411490Z,1
,0,2021-03-23T14:13:47.881450Z,1044,1,"as my hon .friend know , that suggestion have be make , but I do not want to anticipate any decision of the Foreign Ministers .we favour additional support for the Presidency , possibly by a small team of officer second from national diplomatic service , although we want to avoid create a new bureaucracy .we be interested in our partner ' view .",2021-03-23T14:13:47.881483Z,1
,0,2021-03-24T10:13:27.753213Z,1045,2,"the real issue be the independence of local government .the hon .Member appear to wish that local authority should become little more than the agent of the Government .we have already go a long way in that direction as a result of the Government 's effort .the hon .member seek to take that process far .he know that if the Bill be to have effect , the task of local government throughout the country would be make more difficult .he be advocate a course which would lead to bureaucracy go mad .",2021-03-24T10:13:27.753256Z,1
,0,2021-03-23T14:13:53.530074Z,1046,1,"we be not alone in oppose the principle of charge for planning application .at an early stage the CBI make known its objection .its reason for do so be well known .first , the planning system be design to protect the community generally .it should be finance accordingly and pay for by the community .that principle have hold for over 150 year .secondly , the ability to recover cost will remove the incentive to achieve efficiency .planning charge will sustain and not diminish bureaucracy .do the Government ignore the view of the CBI as well as those of the Opposition ?",2021-03-23T14:13:53.530112Z,1
,0,2021-03-24T10:32:21.257025Z,1047,1,"like my hon .friend the Member for Edmonton ( Mr. Graham ) , I be opposed to the introduction of these regulation .I have often hear conservative member say that they want to do away with bureaucracy in local government , yet they be now introduce measure which will add to that bureaucracy .",2021-03-24T10:32:21.257064Z,1
,0,2021-03-23T14:14:01.129470Z,1048,5,"the measure be complicated , unnecessary and petty .it be an extraordinary monument to a Minister who presumably subscribe to his party 's slogan about a free market and free industry to get on with the job .it be no good the Minister rabbit on as he do about clause , subsection and exemption pile upon exemption , when at the end of the day all that we be create , to no good purpose and to no good end , be a bureaucracy and an impositon on the public that we could well do without .",2021-03-23T14:14:01.129508Z,1
,0,2021-03-24T10:13:34.427303Z,1049,3,"that will strengthen the bureaucracy , which be already too strong .we should be curtail bureaucracy .it be wrong to give this power to the planning authority .the measure will add to the cost of building for industry , farming and horticulture .that be at a time when in Northern Ireland we need more industry and more people develop free enterprise .More people should be erect building and promote industry .the order impose a penalty on that activity .",2021-03-24T10:13:34.427337Z,1
,0,2021-03-23T14:14:06.073771Z,1050,6,"""""""in addition to all this inflation which wage council engender , in addition to their remoteness and their atmosphere of""""""""job for the boy """""""" , there be the expense .last year they cost the taxpayer £ 280,000 for bureaucracy alone .that figure pale into insignificance when there be add the cost of 300 inspector and other staff at £ 2½ million a year .for £ 3 million a year I suggest that they be an expensive , unnecessary luxury .""""""",2021-03-23T14:14:06.073820Z,1
,0,2021-03-24T10:36:52.873508Z,1051,1,"my right hon .friend will recognise that the cost of extra wage and salary , to which he rightly refer , be £ 900 million in the last year .will he kindly tell the House when he propose to carry out our election pledge to simplify and decentralise the service and cut back on bureaucracy ?when shall we see some cut in the number of administrator in the Health Service ?",2021-03-24T10:36:52.873551Z,1
,0,2021-03-23T14:14:24.611372Z,1052,5,"do hon .member want a London in which the public sector operate in the realm of financial reality to undertake the work that be its proper province , while enable the private sector to generate the wealth that be need to restore the prosperity of its rundown area , or do they want a financial fantasy world with rate demand and bureaucracy expand to drive out or kill the people and business on which the capital depend ?londoner , not the Labour Party , must decide on 7 May.if they study the fact and not the rhetoric and smokescreen of the marxist manifesto , I have no doubt that they will choose to continue with an administration that be sane , caring and progressive , and that have our support and admiration .",2021-03-23T14:14:24.611426Z,1
,0,2021-03-24T10:19:07.528985Z,1053,1,"I turn to marketing .I welcome what my right hon .friend say about the work that he have do since he take office .marketing form an indispensable part of a successful agriculture industry .unfortunately , it have be one of the weak aspect of british agriculture .there be a danger that in advance the cause of marketing we be likely to create the impression that we be interested in set up yet another bureaucracy .in short , the requirement to market must lead to a well marketing of the marketing system .it be necessary to convince those concerned that they need to engage in marketing .if they be not convinced there be the danger that they will consider marketing as merely another layer of bureaucracy .",2021-03-24T10:19:07.529018Z,1
,0,2021-03-23T14:14:32.911163Z,1054,5,the idea that the public receive a well service by increase local authority representation on the water authority be a red herring .local government representative on the water authority be already find it difficult to find out what be go on and difficult to attend meeting .in Wales they complain about the distance involve and they have no hope of control the bureaucracy .,2021-03-23T14:14:32.911218Z,1
,0,2021-03-24T10:32:24.323004Z,1055,1,"the NCC say that it can cope with this work without increase its bureaucracy .as the Minister will know , in order to obtain a grant the owner of an SSSI , if he be do agricultural development , have to consult the NCC .therefore , all that we be do be extend this to non - grant - aid work .we be talk of perhaps 100 site a year , scatter throughout the United Kingdom .",2021-03-24T10:32:24.323056Z,1
,0,2021-03-23T14:14:39.443178Z,1056,1,"do not the Secretary of State agree that child benefit be often a lifeline for a family whose circumstance suddenly change — for example , when a mother have be desert or a wage earner become unemployed ?be it not true that the present payment system ensure that the family have some money while other benefit be sort out ?will he guarantee that the new bureaucracy will allow a mother who wish to switch from monthly to weekly payment to do so in a matter of minute at a social security office , rather than wait several week ?",2021-03-23T14:14:39.443227Z,1
,0,2021-03-24T10:19:15.821532Z,1057,5,"""""""another reason , follow on from that , be that the Bill to which the hon .member for Provan refer roll back bureaucracy .for too many year in Scotland local politician and local bureaucrat have say to people who live in council house , """""""" you can not paint your door the colour that you want it .you can not keep a dog even if you want to .you have get to get out of this council house where you have live for 30 or 40 year because we have decide that you be no long a suitable tenant . """"""""""""""",2021-03-24T10:19:15.821572Z,1
,0,2021-03-23T14:14:43.132788Z,1058,1,"one of the great complaint from small business , which we all understand , be the amount of paper work impose by bureaucracy .we must remember that business man be active , go - ahead people who do not wish to be over - burden by detailed requirement .they do not want their activity cramp by office work .",2021-03-23T14:14:43.132847Z,1
,0,2021-03-24T10:38:42.162893Z,1059,1,"""""""it be true that other benefit do not apply to an establishment wholly or mainly within a zone .to avoid bureaucracy we think it desirable not to divide the establishment for the purpose of the clause and the training levy .previously , the clause include the word """""""" wholly inside the zone """""""" .that would mean that be even a few square foot outside the zone would disqualify the whole establishment .that be why we have use the phrase """""""" wholly and mainly """""""" .the concept of """""""" establishment """""""" do not appear in exist legislation affect enterprise zone , because """""""" establishment """""""" be primarily a concept of employment law .other Acts , for example , refer to hereditament and not to establishment .""""""",2021-03-24T10:38:42.162947Z,1
