annotation_approver,comment_count,created_at,id,label,text,updated_at,user
,0,2021-03-23T09:13:04.700189Z,869,1,"we be now get proof that many Labour member do not believe in the private ownership of industry and the mixed economy .if the State spend 60 per cent .of GNP , one can see how easily the remain 40 per cent .could be gobble up .let we consider the amount of paper use in this place and throughout our bureaucracy .it lead I to wonder whether the paper industry should be one of the first to be nationalise .",2021-03-23T09:13:04.700253Z,1
,0,2021-03-24T10:05:39.552282Z,870,3,"the demand have be for much less government .the response have be more government , more member of Parliament , more bureaucracy , and more cost .",2021-03-24T10:05:39.552340Z,1
,0,2021-03-24T10:05:40.390604Z,870,6,"the demand have be for much less government .the response have be more government , more member of Parliament , more bureaucracy , and more cost .",2021-03-24T10:05:40.390649Z,1
,0,2021-03-23T09:14:01.611060Z,871,3,"perhaps in future it might be wise to bring all these body together .perhaps in time to come we can evolve some form of regional authority , but it should be as a replacement for a tier of authority , not an addition to it .an extra tier of bureaucracy in Scotland and Wales or any of the region of England , be completely unnecessary and highly expensive .the people be feed up with over - much interference .they want less , not more , government .",2021-03-23T09:14:01.611119Z,1
,0,2021-03-23T09:14:02.555198Z,871,6,"perhaps in future it might be wise to bring all these body together .perhaps in time to come we can evolve some form of regional authority , but it should be as a replacement for a tier of authority , not an addition to it .an extra tier of bureaucracy in Scotland and Wales or any of the region of England , be completely unnecessary and highly expensive .the people be feed up with over - much interference .they want less , not more , government .",2021-03-23T09:14:02.555236Z,1
,0,2021-03-23T14:03:15.180723Z,872,6,we have hear in the debate a great deal of criticism of the detail — indeed more than just the detail — of the Bill .the creation of an Executive for the Scottish Assembly have be criticise as bring with it a series of inherent tension between that Assembly and Westminster and also in its train an unnecessarily burdensome bureaucracy and expense .,2021-03-23T14:03:15.180790Z,1
,0,2021-03-23T14:03:16.295411Z,872,3,we have hear in the debate a great deal of criticism of the detail — indeed more than just the detail — of the Bill .the creation of an Executive for the Scottish Assembly have be criticise as bring with it a series of inherent tension between that Assembly and Westminster and also in its train an unnecessarily burdensome bureaucracy and expense .,2021-03-23T14:03:16.295491Z,1
,0,2021-03-23T09:14:08.702662Z,873,1,"as my hon .friend the Member for Edinburgh , Pentlands ( Mr. Rifkind ) point out in the White Paper debate , the Conservative Party have oppose consistently the establishing of a separate Executive or Government in Scotland , largely on account of the over - government and additional bureaucracy it would create ; but to have a separate Government without any revenue raise power , as the Bill propose , would be to sow seed of frustration and disillusionment throughout Scotland .",2021-03-23T09:14:08.702920Z,1
,0,2021-03-24T10:35:19.577355Z,874,2,"I agree , therefore , with the right hon .Member for Belfast , East that we can conclude that government in Britain , at central and local level , have become increasingly inefficient and remote as the bureaucracy that fatten on it have be allow to grow , but I draw very different conclusion from those that he lay before the House .for the life of I , I can not see how add another tier of authority and thousand more bureaucrat in Scotland and Wales will improve these matter .I should have think that they would inevitably add to inefficiency and that the sort of Assembly envisage in the Bill would lead to frustration and discontent of a kind that would enable the Scottish National Party to continue to thrive and to move towards the inevitable conclusion that only complete separation be the answer .I see that I carry with I in that the hon .member for Dunbartonshire , East ( Mrs. Bain ) .if that be so what a mess of pottage to put before a serious deliberative Assembly .",2021-03-24T10:35:19.577398Z,1
,0,2021-03-24T10:35:21.256615Z,874,3,"I agree , therefore , with the right hon .Member for Belfast , East that we can conclude that government in Britain , at central and local level , have become increasingly inefficient and remote as the bureaucracy that fatten on it have be allow to grow , but I draw very different conclusion from those that he lay before the House .for the life of I , I can not see how add another tier of authority and thousand more bureaucrat in Scotland and Wales will improve these matter .I should have think that they would inevitably add to inefficiency and that the sort of Assembly envisage in the Bill would lead to frustration and discontent of a kind that would enable the Scottish National Party to continue to thrive and to move towards the inevitable conclusion that only complete separation be the answer .I see that I carry with I in that the hon .member for Dunbartonshire , East ( Mrs. Bain ) .if that be so what a mess of pottage to put before a serious deliberative Assembly .",2021-03-24T10:35:21.256791Z,1
,0,2021-03-23T09:14:12.701244Z,875,2,"the next problem be that of unresponsive remote bureaucracy .successive british government be widely think to have be guilty of these undesirable characteristic in the way they have seek to govern the country , and this criticism have be apply as much to local as to national government .",2021-03-23T09:14:12.701311Z,1
,0,2021-03-23T14:03:20.228260Z,876,1,"to those people an Assembly would mean more expense , more Departments of State , more election , more confusion , more bureaucracy , more law and more taxis .they do not want that .they want government to be simplify .therefore , transfer we and our power from here to Scotland .do not , for God 's sake , let the octopus have another child in its own image .",2021-03-23T14:03:20.228313Z,1
,0,2021-03-23T09:14:19.595299Z,877,1,"the Secretary of State should address himself to the consequent great fear in Wales that the Government 's proposal will lead to a considerable addition to bureaucracy and officious meddling and supervision of local government by the Assembly .it be suggest that it will be costly and virtually another tier of local government .the right hon .and learn Gentleman remark that my right hon .friend the Member for Devon , North ( Mr. Thorpe ) once say of the power propose for the Welsh Assembly that they would provide for a glorify Glamorgan County Council .he suggest that in many quarter that would be regard as a tribute .I do not know about that , but I know that in many quarter that comparison would be regard as highly defamatory .my right hon .friend be right in that there be a fear that an Assembly with the power that be propose will have a good deal of ability to meddle in local government and will prove extremely costly .",2021-03-23T09:14:19.595339Z,1
,0,2021-03-24T10:05:46.365294Z,878,1,"morale in small business be low , and it have be lower partly by this unnecessary burden of paperwork and bureaucracy .the Government 's tax and pay policy treat skilled and qualified people , such as manager and accountant , as some sort of criminal against society .their effort and success be penalise and resent as anti - social .these be the people whom we should encourage .their energy should be devote to manufacturing and selling , but already there be a big credibility gap about the Government 's industrial strategy and unless they do something about this problem , it will get very much bad .",2021-03-24T10:05:46.365345Z,1
,0,2021-03-23T09:14:31.300061Z,879,1,"I be sure , Mr. Deputy Speaker , that you be aware that there be not an hon .member who could not produce the same kind of letter , except that we on this side of the House recognise that most of those who write such letter be politically motivated and inspire and that what they say bear no relation to the fact .the hon .Gentleman be attempt to produce evidence to show the damage cause to industry .in fact , he do not mention the word damage during his speech and he have not show any of the damage that have be cause to industry and commerce by an excess of Government bureaucracy .we have have no illustration of the damage to either industry or commerce .we have have no indication of the so - call excess of bureaucracy .I be sure that there be an excess of bureaucracy .I be sure , too , that there be a little fat in the Civil Service that we could pare .but the hon .Gentleman do not illustrate it .he do not indicate specifically and directly the area in which we should be pare the size of the bureaucracy .",2021-03-23T09:14:31.300126Z,1
,0,2021-03-23T09:14:37.130014Z,880,3,"as many hon .member have say in the past , and will continue to say as the Bill progress , there be nothing wrong with hammer home a point simply because it have be make before .we should convince the people of this country , and the repetition and hammer home of the basic point will achieve the realisation that extra cost and extra bureaucracy be involve and that the unity of the United Kingdom be be imperille .this be a recipe for conflict and discontent .",2021-03-23T09:14:37.130068Z,1
,0,2021-03-23T14:03:28.777143Z,881,2,"thirdly , this seem to be a pave Bill for a yet further spread of bureaucracy .I be certain that if the Minister of State — who have be Minister responsible for sport , Minister responsible for water and Minister responsible for the drought , and be now champion of the leek himself in Wales — stay in office , we shall get a national water grid and all the paraphernalia of a high water tier , more civil servant employ , and the general confusion that so often spread not so much from a socialist approach but from a bureaucratic approach to a problem which can be perfectly well handle by individual water board concern .",2021-03-23T14:03:28.777203Z,1
,0,2021-03-23T09:14:47.066278Z,882,4,"I do not believe that we shall have a sensible water policy until we have a national water grid .I want all water supply to be nationalise .that need not lead to a tremendous bureaucracy .it can be rationalise and make subject to elect authority .that be another reason for have regional elect authority as part of a federal system of devolution .if it do not happen , the United Kingdom will break up .however , that be as irrelevant a point as one or two of the issue raise by the right hon .member for Bermondsey , so I feel that I be in good company .",2021-03-23T09:14:47.066434Z,1
,0,2021-03-24T10:27:16.739433Z,883,3,it be quite obvious that the growth of bureaucracy have go on throughout the age .I merely want to point out that I do not like the constant emotive use of the term .,2021-03-24T10:27:16.739492Z,1
,0,2021-03-23T09:14:51.785712Z,884,4,"there be no such large store of wealth and there have not be for many year past .but there be a considerable stock of asset control by the nationalise industry and by the State in the name of the people , and very large bureaucracy have grow up in the nationalise industry .I agree with the concept of the Labour Party , a fundamental shift of wealth from the rich to the poor , if , as I believe , that mean hand over the asset to the worker in the nationalise industry .at present there be very little return from some of our nationalise industry .",2021-03-23T09:14:51.785759Z,1
,0,2021-03-23T14:03:32.903350Z,885,1,"let we continue with the saga , for it be one very revealing of the extent to which the bureaucracy be lead we into a situation that would have do credit to the great inventor of nonsense .I be sure that Lewis Carroll and Edward Lear would not have believe that this could go on .",2021-03-23T14:03:32.903436Z,1
,0,2021-03-23T09:15:03.772718Z,886,1,"I wish to make one point in favour of bureaucracy .a jobcentre be open in the Lydney area of my constituency and as a result there be an initial increase of 40 per cent .in the number of people find job .that have now settle down at an increase of 20 per cent .above the previous level .I therefore urge my right hon .friend to study the beneficial effect of the jobcentre , because in area such as our those benefit can be enormous .",2021-03-23T09:15:03.772778Z,1
,0,2021-03-24T10:05:51.545393Z,887,1,"there be many argument that one could make — bureaucracy , the failure to have one Bill for Scotland and another for Wales , and whether the Bill be really want .my view be that we should defeat the guillotine with a view to defeat the Bill .",2021-03-24T10:05:51.545430Z,1
,0,2021-03-23T09:15:08.771607Z,888,1,"I be pleased to hear the Minister 's response to my question .do he accept that there be too much bureaucracy and secrecy in the administration of the Prison Service and that there be a great need for well public relation between the Prison Service and the general public ?do he agree that there be a dire need for the Home Office to give an early official response when incident occur rather than , as at present , the Home Office attitude lead to outside body publish document that be often misleading ?",2021-03-23T09:15:08.771667Z,1
,0,2021-03-23T14:04:47.567696Z,889,5,"the Bill provide that the Government should be a second source of revenue .but why do we need all this paraphernalia ?if the Government want to do something , let they do it through the local authority .why set up this paraphernalia to upset the building society and the exist structure , impose the dead hand of bureaucracy ?a nationalise set - up would not prosper .",2021-03-23T14:04:47.567747Z,1
,0,2021-03-23T09:15:21.116602Z,890,1,"in short , because of the GLC 's non - commitment to instal the infrastructure of redevelopment , commerce and industry , which have and still have vast amount of money to invest if there be an end product for they , have come up against bureaucracy .they have vast amount to invest , but they will not commit their resource until the infrastructure be there .there must , therefore , be a definite , positive policy to attract the money that be available , which will encourage growth and potential .",2021-03-23T09:15:21.116657Z,1
,0,2021-03-24T10:38:03.878950Z,891,1,"there be an advantage in this from the point of view of the House .if we have large permanent staff of expert we should set up a parliamentary bureaucracy .Bureaucracy be very often criticise when it be in the form of the Civil Service , but it would be no well for be a parliamentary bureaucracy .I have refer to this on previous occasion .in the United States the very large number of people who be serve committee full - time build up on inertia in those committee , a sort of perpetuation , which do not and can not happen here at present with the Expenditure Committee .we should be well on our guard to resist that .",2021-03-24T10:38:03.879003Z,1
,0,2021-03-23T09:15:30.530454Z,892,2,"""""""on pay policy in stage 3 , we should prefer the abandonment of any attempt to fix so - call """""""" fair """""""" wage by a bureaucracy out of touch with reality .instance in my constituency of the lack of fair play in the present system go to the heart of the matter .for instance , when the two side of the present water authority be bring together in 1974 , they have different pay structure .the difference now between worker do exactly the same work side by side be over £ 15 a week .People can not be expect to tolerate that sort of unfairness much long .great flexibility be need , if not an end to the present system altogether .""""""",2021-03-23T09:15:30.530500Z,1
,0,2021-03-23T14:04:54.403262Z,893,1,"this be not a matter of bureaucracy or of administration .if it be , it might very well lie in the hand of the Chairman of the Board of Inland Revenue or of Treasury Ministers to do something about it .unfortunately , this be a matter not of legal technicality , as the hon .Gentleman suggest , but of an interpretation of the law or of the Inland Revenue act accord to the legal advice that it have receive from its adviser .",2021-03-23T14:04:54.403301Z,1
,0,2021-03-23T09:15:47.946909Z,894,2,"I believe it be generally accept in all part of the House that we be somewhat over - legislate .but nowhere be the burden of such legislation feel more greatly than among small business and self - employ worker .they do not have the staff to cope with the unnecessary bureaucracy impose by government who have enter area which they know little about and in which , with respect , I consider they should not be .perhaps I shall say more about this in another debate .",2021-03-23T09:15:47.946980Z,1
,0,2021-03-23T09:15:49.837022Z,894,3,"I believe it be generally accept in all part of the House that we be somewhat over - legislate .but nowhere be the burden of such legislation feel more greatly than among small business and self - employ worker .they do not have the staff to cope with the unnecessary bureaucracy impose by government who have enter area which they know little about and in which , with respect , I consider they should not be .perhaps I shall say more about this in another debate .",2021-03-23T09:15:49.837056Z,1
,0,2021-03-24T10:06:11.166934Z,895,6,"the boat builder , too , be concerned about high - rate vat .it have come down from the punitive level of 25 per cent .but it be still possible to carve up a boat trailer into three different rate of vat — zero rate , low rate and high rate .the complexity be such that the bureaucracy can not conceivably pay for the additional revenue which alone should justify taxation .although again I say this to put it on the record , I hope that the Minister will realise the difficulty .",2021-03-24T10:06:11.166999Z,1
,0,2021-03-23T09:15:57.489010Z,896,1,I turn to the main aspect of the debate — the common agriculture policy .I want to look ahead .some surprising statement have be make in the debate .I object to the Common Market because of the amount of horse trading and the massive bureaucracy .too large a share of the FEOGA budget be use to prop up the market .the Ministers involve tend to forget the protection of the consumer in favour of the producer .too little be spend on the protection of the consumer and too much on prop up the market .those be my reason for oppose the Market .those be the reason give by the right hon .member for Yeovil ( Mr. Peyton ) .that be how he open his speech .I welcome his confession .,2021-03-23T09:15:57.489089Z,1
,0,2021-03-24T10:27:27.064702Z,897,6,"let we consider whether something can be do with the threshold level to try to improve the tax .in his article in the Accountant on 24th March , Mr. Sweeting try to link compliance cost and the direct administrative cost of the Customs and Excise to establish a total cost of collect the tax from small and not - so - small retailer .let we consider some of the horror that he expose .he make it clear that he be not blame the Customs and Excise Department , but that the nature of the tax and its present threshold be to blame .the article say : what accountant with the good interest of his client at heart would automatically recommend sale and purchase day book and ledger for business with an annual turnover of less than £ 50,000 ?only an unimaginative pedant .they be costly and time - consume to run .he be not comment on some super - collectivist scheme dream up by centralise State Socialism .this tax be introduce by the suppose lover of efficiency and enemy of bureaucracy — the Conservative Party .accord to the Customs and Excise , there be 1,250,800 person register as vat payer on 1st March 1976 .they pay a net amount of £ 3,385,000 in tax .but it be when we come down the scale that we run into difficulty , because 367,000 of them—29·4 per cent .of the total of taxpayer — receive refund of £ 618 million , and those refund cost the Customs and Excise Department a far £ 20 million to administer .",2021-03-24T10:27:27.064758Z,1
,0,2021-03-23T09:16:09.670356Z,898,1,"""""""one of the problem be that people live in council housing be not quite sure who it be they be talk to .I be constantly come across this on my interview day at what be know as my surgery .only last week I have three council tenant come to I and say """""""" I have put in for repair and have a note say that the work would be do in a month , but nothing have be do for 18 month . """"""""they go to the office .they see a clerk there , who may well be sympathetic , but there be a vast bureaucracy .""""""",2021-03-23T09:16:09.670399Z,1
,0,2021-03-23T14:07:56.251074Z,899,6,"I turn to the particular recommendation that have attract most discussion and controversy .first there be the proposal to give the fourth television channel to a new body , the Open Broadcasting Authority .despite my basic dislike of new body , which lead to more bureaucracy and cost , I certainly appreciate the Committee 's purpose .it want to ensure , as I understand it , that when a fourth channel be introduce it would provide programme of different sort , that minority interest would be cater for , and that independent producer would have great opportunity .the thinking behind the proposal for the Open Broadcasting Authority be , therefore , both original and imaginative .",2021-03-23T14:07:56.251117Z,1
,0,2021-03-23T09:16:20.759711Z,900,2,"even if my colleague be not here , include the hon .member in whose constituency Speke Airport be situate , the hon .member for Liverpool , Garston ( Mr. Loyden ) , I be glad of the opportunity to air the important subject of Liverpool 's airport .as the Minister well know — because he courteously correspond with I at great length over a long period , and have see , with I , representative of the chamber of commerce , and other interested party — the airport provide an essential outlet for industrialist on Merseyside .they tell I that they prefer it to Manchester , because they receive a quick and more personal service .the cargo section be efficiently run , with a minimum of bureaucracy .Size bring with it bureaucracy and delay .the small , personal concern of Speke , run as a family business would be run , give industrialist on Merseyside a great service .",2021-03-23T09:16:20.759755Z,1
,0,2021-03-23T09:16:22.882825Z,900,3,"even if my colleague be not here , include the hon .member in whose constituency Speke Airport be situate , the hon .member for Liverpool , Garston ( Mr. Loyden ) , I be glad of the opportunity to air the important subject of Liverpool 's airport .as the Minister well know — because he courteously correspond with I at great length over a long period , and have see , with I , representative of the chamber of commerce , and other interested party — the airport provide an essential outlet for industrialist on Merseyside .they tell I that they prefer it to Manchester , because they receive a quick and more personal service .the cargo section be efficiently run , with a minimum of bureaucracy .Size bring with it bureaucracy and delay .the small , personal concern of Speke , run as a family business would be run , give industrialist on Merseyside a great service .",2021-03-23T09:16:22.882865Z,1
,0,2021-03-24T10:09:38.076348Z,901,1,"to continue to be practical , I hope not only in a technical sense but also in a political sense , I suggest that we should be realistic about some of the resistance to the establishment of the common fund .when I be in Washington I hear quite explicitly from official of AID , the department responsible for overseas aid in the United States , that a powerful argument against the idea of a common fund be that there would be a new bureaucracy and that bureaucracy would inevitably be dominate by the Group of 77 , that we should have the term of work of the common fund and its system stack against we as consumer .the bargaining chip , as it be , would be stack against we .",2021-03-24T10:09:38.076414Z,1
,0,2021-03-23T09:16:27.815677Z,902,1,"do the hon .gentleman agree that we be not discuss the question of power , but that Amendment no .1 be deal with the institution itself ?I trust that he will agree , on reflection , that we be deal with redundant bureaucracy .",2021-03-23T09:16:27.815760Z,1
,0,2021-03-23T14:08:01.052813Z,903,1,"I quite understand that the large business , so often represent by hon .member on my right , can take these code in their stride because they have vast staff of train lawyer who can deal with code .but if one ask a small business man whether , give this wicked and unhappy world , he would rather have a byzantine code that one have to study for night on end with a towel over one 's head or a bureaucracy of flesh and blood , I be sure that we would get an answer for the latter .I be glad that the Committee , even though poor for the lack of a liberal presence , have the sense to get rid of the code within 12 month .",2021-03-23T14:08:01.052893Z,1
,0,2021-03-23T09:16:51.533993Z,904,7,"in all the Common Market discussion and the great debate on the issue the anti - marketeer make a great deal of the excessive bureaucracy in the Community .those of we who support our entry into the EEC believe that direct election to the European Parliament would help to democratise the Community and the Commission , and to make the whole process of european decision - make more sensitive to public opinion .we also believe that , because this country have a long experience of democracy and the working of democratic institution than other member country of the EEC , we should give a lead .however , as a country we have drag our foot .",2021-03-23T09:16:51.534155Z,1
