annotation_approver,comment_count,created_at,id,label,text,updated_at,user
,0,2021-03-22T16:00:35.167065Z,714,3,"it have be say that this change in ownership will bring with it certain advantage .what be be propose be simply put the State in place of group of public authority , in some case municipal enterprise , and in one case a privately - own authority .they will be bring together , and the state will be the control factor instead of various local body .this will create more problem , and more bureaucracy .what be more important , it be pointless , and it will destroy what local interest and concern there be in many of these area .",2021-03-22T16:00:35.167101Z,1
,0,2021-03-22T16:00:46.020415Z,715,5,"my hon .and learn friend make it clear that to he the right to privacy be an essential component of the liberty of the subject .he point to the growth of bureaucracy , and cite the staggering fact that no few than 10.000 national and local government officer now have the legal right to enter private home .that we receive so few complaint about the exercise of these power be very remarkable evidence of the high standard maintain by those officer , but since these power be continually multiply , we may expect that the number of case have to be draw to our attentiton will increase as time go on .",2021-03-22T16:00:46.020452Z,1
,0,2021-03-22T16:01:11.534277Z,716,3,"another thing which have upset morale be the level of appointment to senior management from outside .I be not here make any criticism of the right hon .Member for St. Pancras , North ( Mr. K. Robinson ) but the fact that a number of people be be introduce on to the Board and into various level of the Corporation from outside be now begin to unsettle the management structure and people be begin to feel that the management ladder be become more and more difficult to climb .as for the number of large central department set up by the Corporation , its administrative cost and administrative bureaucracy have get much too big .I do not criticise individual , but the Corporation itself be become a bureaucratic giant .",2021-03-22T16:01:11.534311Z,1
,0,2021-03-22T16:01:32.031230Z,717,3,"""""""if it have a real purpose , it be quite different , namely , the purpose of give Ministers and civil servant power to influence the commercial decision of company behind the scene ; to make company subservient to Whitehall .quite apart from the ant - heap of bureaucracy which it will throw up , it seem likely to create less competition rather than more , to create less of a competitive and more of a play - safe psychology .to create a situation in which , before a company can make decision , it have to go along to its guardian under - secretary in the appropriate Department and say , """""""" please , Sir , I want to do this , and may I do that ?"""""""" , be not the way to create an environment in which we can encourage competitive , vigorous , risk - taking , innovate , fast - move board of director and management in this country .on the contrary , this run to the gentleman in Whitehall be one of the most enervate influence on british industry ; and it be disastrous if it be continue .""""""",2021-03-22T16:01:32.031270Z,1
,0,2021-03-22T16:01:40.465086Z,718,1,"be the hon .gentleman aware that our present ore terminal facility be quite inadequate ?be he far aware that many people on Clydeside fear that the unique opportunity offer by its deep - water facility will be lose to Scotland because of the number of Government Departments involve , include the Board of Trade , the Treasury and the Ministry of Transport ?will the future of the plan be lose because of massive bureaucracy and demarcation dispute between the Ministries involve ?",2021-03-22T16:01:40.465122Z,1
,0,2021-03-22T16:01:47.851286Z,719,1,"while the Minister may make excuse , I be sure that he will agree that there have be a sad decline in National Savings .be it not time , rather than make marginal adjustment , to have a radical re - examination of the whole institution and machinery of National Savings particularly , for instance , the Department of National Savings with its 15,000 civil servant ?would not less bureaucracy mean a well deal for the small saver ?",2021-03-22T16:01:47.851335Z,1
,0,2021-03-22T16:01:55.954529Z,720,3,"""""""do my right hon .friend recall that one of the great argument for the measure which he have announce be that there should be a net reduction — I emphasise """""""" net reduction""""""""—in the size of the bureaucracy ?what sort of net reduction have he in mind ?""""""",2021-03-22T16:01:55.954574Z,1
,0,2021-03-22T16:02:05.809223Z,721,5,"with the passage of time the State be become more and more involved in more and more aspect of our everyday life .this problem be confront civilised society throughout the world .we must ensure that the State do not become more authoritarian .I need not mention how frequently hon .member speak of the danger of bureaucracy .we must develop institution and practice , and train man and woman , to ensure that the right and freedom of the individual be safeguard and protect .",2021-03-22T16:02:05.809250Z,1
,0,2021-03-22T16:02:07.330381Z,721,7,"with the passage of time the State be become more and more involved in more and more aspect of our everyday life .this problem be confront civilised society throughout the world .we must ensure that the State do not become more authoritarian .I need not mention how frequently hon .member speak of the danger of bureaucracy .we must develop institution and practice , and train man and woman , to ensure that the right and freedom of the individual be safeguard and protect .",2021-03-22T16:02:07.330418Z,1
,0,2021-03-22T16:02:22.443805Z,722,6,"I propose now to refer — and perhaps no one else will do so — to the setting up of the great new bureaucracy propose by the Government to deal with trade unionist .the Department will need 90 more staff ; the N.R.C.will need 40 ; the Industrial Tribunals will need another 320 ; the Commission on Industrial Relations will need about 435 additional staff ; the Chief Registrar of Trade Unions and Employers ' Associations will need 50 staff .all together about 1,250 extra staff will be recruit and the Bill and all that be enshrine in it will cost £ 5 million per annum .I be just wonder how much of that will go to the lawyer .there be no question about it — it be a new industrial bureaucracy .I do not know whether the Secretary of State want to intervene .I think lie be disagree with I .",2021-03-22T16:02:22.443836Z,1
,0,2021-03-22T16:02:33.061137Z,723,6,"I appreciate the right hon .Gentleman be give I this opportunity .I expect he know that the cost of his right hon .Friend 's Bill , which be print last summer but never debate , would have be a little under £ 4½ million , which be not very different .as to the great industrial bureaucracy about which he speak , some 75 per cent .or 80 per cent .of the extra people will be engage in conciliation .unlike the right hon .Lady , I do not believe in boast about how few of my Department be engage in conciliation .I shall be glad when a high proportion of they be .",2021-03-22T16:02:33.061173Z,1
,0,2021-03-22T16:02:48.701196Z,724,3,"I be sorry to do this , for I do not wish to keep interrupt the right hon .Gentleman , but when he talk about bureaucracy and a large increase in staff , we be talk about conciliation staff .",2021-03-22T16:02:48.701230Z,1
,0,2021-03-22T16:03:11.536322Z,725,3,"my hon .friend from all part of the country have express grave fear for the future of british horticulture if the eastern european quota increase far .if this pattern of counter - trade be encourage they will also be alarm .I call on my hon .friend to control it and to honour the spirit of our manifesto at the last election , which contain these word : farmer be frustrated and disgruntle … we will provide new opportunity for the farming community to increase production , improve their income , and make a further massive contribution through import save to the balance of payment .the manifesto go on to say : we will continue to encourage the development of british horticulture … by contrast , I fear that the official of the Department of Trade and Industry have lead Ministers to continue the precise wrong policy of the previous Administration , and british horticulturalist can hardly be blame for think that it be official rather than Ministers who rule we .it be hardly surprising that grower should fear the great bureaucracy of Europe if we should join the European Economic Community .",2021-03-22T16:03:11.536349Z,1
,0,2021-03-22T16:03:29.383170Z,726,3,"the point I be make be that a reduction in the bureaucracy be of crucial importance , but the reduction of civilian personnel be not an end in itself .one of the problem be that we be actively civilianise the Armed Forces in order to relieve the burden on the military manpower .",2021-03-22T16:03:29.383218Z,1
,0,2021-03-22T16:03:39.657217Z,727,3,"I can reassure my hon .friend , because we can achieve both objective ; that be to say , by reduce bureaucracy in England and transfer to Scotland , we can end with a low total .",2021-03-22T16:03:39.657259Z,1
,0,2021-03-22T16:03:50.205817Z,728,1,"have say all that , my right hon .friend , with his superior draftsmanship and all the service of the technical bureaucracy at his elbow — I be glad to see my right hon .friend nodding assent — have set down on the Notice Paper a group of new Clauses and a large number of amendment to which 1 , with alacrity , have add my name , sure in the knowledge that once my name , as the principal sponsor of the Bill , appear on the Notice Paper support my right hon .friend 's legislative intent , my name immediately take precedence over his , and I therefore move the Government 's new clause .that be exactly the position that I seek to create .",2021-03-22T16:03:50.205860Z,1
,0,2021-03-22T16:03:59.221337Z,729,2,"the hon .Gentleman appear to want the same board to be responsible for levy all the small travel agent .first , the board would have to sort they out , then find they , and would then have to levy they .at the propose rate of levy in the order , the maximum amount such a firm would have to pay would be £ 99 .if such a sum be levy at the rate require by the hon .Gentleman , the maximum amount would be £ 198 .then there would be ail the paraphernalia involve in fill in form and claim back the grant .this would be bureaucracy go mad .",2021-03-22T16:03:59.221384Z,1
,0,2021-03-22T16:04:46.337421Z,730,1,"the Minister have write the Board off with some reference to gimickry and bureaucracy .I say that the reference on retail price margin which my right hon .friend the Member for Blackburn ( Mrs. Castle ) and I make to the Board be not a gimmick .it be make after a good deal of though and if hon .gentleman opposite will refer to the Food Manufacturers ' Federation , with which I discuss this reference , they will find that the Federation support it fully and be anxious that it should be fully process .",2021-03-22T16:04:46.337477Z,1
,0,2021-03-22T16:04:54.611839Z,731,5,"I register an objection on behalf of my City Council and the citizen of Norwich , irrespective of their political party ; and I register my own objection at these proposal as one who have always be oppose to remote control and to the extension of bureaucracy .on no account will I vote in favour of any legislation that be propose on the line of the White Paper since it practically wipe out the good , compact , all - purpose authority .",2021-03-22T16:04:54.611898Z,1
,0,2021-03-22T16:05:19.114028Z,732,3,"if the right hon .Gentleman have his way , if he disregard the strong criticism by the county council and many other people , and go on with this terrible policy of inspissate the middle bureaucracy , he will destroy the good thing in the National Health Service and strengthen the bad thing in it .",2021-03-22T16:05:19.114065Z,1
,0,2021-03-22T16:05:31.579674Z,733,3,"have my hon .friend fail to remember that 13 month ago today I stand on election platform on the eve of the poll promise , in consonance with my party 's policy , a drastic curtailment of the bureaucracy ?as the Minister responsible for the bureaucracy be prove to be such a dismal failure , will my hon .friend prevail upon his colleague to alter their policy and secure the reduction of 50,000 civil servant which be urgently need ?",2021-03-22T16:05:31.579738Z,1
,0,2021-03-22T16:05:43.190748Z,734,1,"I must pursue the point that Lord George - Brown be send on the negotiation in order to succeed , and he be not send to Europe as a ruse of the then Prime Minister to keep he out of Britain .therefore , for I it be a very great cause for sadness to read the speech which the right hon .Gentleman the Leader of the Opposition quote , from the Times on Monday , 19th July , 1971 , report the conference on Saturday : the negotiation would show whether the Community be a rule - ride bureaucracy ; whether in its motivation it be look outward to a Europe - wide unity , or whether it be basically an agricultural welfare complex base on subsidy to high - cost producer … if the right hon .Gentleman have all those reservation about those strange foreigner why do he ever go and negotiate with they in the first place ?that be what we be entitle to ask .",2021-03-22T16:05:43.190789Z,1
,0,2021-03-22T16:05:51.369213Z,735,7,"second , there be the anxiety about democracy versus bureaucracy , this spectre of the Treaty of Rome which be hang over so many people , often those who have not trouble to read it or find out what be really in it .we have to make it clear that the treaty cover a strictly limited area of our national life and , equally , that the decision and activity of the Commission in Brussels , under the supervision of the democratic Council of Ministers , be very strictly circumscribe .here again there be a need for much more reassurance among member of the public who be genuinely troubled .",2021-03-22T16:05:51.369248Z,1
,0,2021-03-22T16:06:08.679622Z,736,3,"it be not only that this rebate be wrong in principle but it also present most formidable practical drawback .the increase in bureaucracy — in the number of rent officer and local authority staff — especially to deal with the gigantic task of administer private rent allowance — go quite counter to all the Government 's pledge about reduce civil service manpower , and it will be interesting to hear what tory back bencher think about that .again , there be the probability of low take - up because people be too proud or too stubborn or too ignorant or find it all too complicated — we can see the pattern from experience of the F.I.S.and rebate scheme in London and Birmingham .",2021-03-22T16:06:08.679657Z,1
,0,2021-03-22T16:06:22.888548Z,737,3,this will be an enormous job call for an enormous bureaucracy .the Government say that a small increase in manpower will be require .that be nonsense .it be the understatement of the year .an enormous team of bureaucrat will be need to assess the rent .rent officer and rent assessment committee will be need to check the rent rebate form .People will have to assess the new council rate .there will be an enormous increase in Civil Service and local government manpower to deal with this crazy scheme whose sole object be to shift the burden of expenditure from the taxpayer to the council tenant .,2021-03-22T16:06:22.888583Z,1
,0,2021-03-22T16:06:35.795495Z,738,1,would the hon .Gentleman accept my congratulation on administer this field at obviously a very small expense ?be he aware that the Government be seek to argue that an international authority to administer exploitation of the sea bed would entail much bureaucracy ?would he agree that the figure he have just quote show that it would do nothing of the kind ?,2021-03-22T16:06:35.795534Z,1
,0,2021-03-22T16:07:10.491597Z,739,1,the hon .member be one of the good example of those who make these usual cheap comment about bureaucracy .,2021-03-22T16:07:10.491635Z,1
,0,2021-03-22T16:07:22.924412Z,740,7,"it be not the time today to argue about the future rôle of the House and of individual member .no doubt a modern Bagehot will emerge and with distinctive eloquence produce another great classic on our Constitution .I will only assert again that more than ever do we need a strong House of Commons , and need to check and probe the Executive , to expose the bumbling of bureaucracy , to participate more in legislative function , to remedy grievance , and above all , to express the desire and ideal of the british people .",2021-03-22T16:07:22.924488Z,1
,0,2021-03-22T16:07:36.752017Z,741,1,"I still wish to stress the importance that my Committee attach to the independence of the local consultative council .as long as these body be mix up in the public estimation with the official of these industry they will not make direct appeal to the public .local consultative council be not recognise by the public as their watchdog , mainly because they be regard as part of the bureaucracy that work these great industry .",2021-03-22T16:07:36.752064Z,1
,0,2021-03-22T16:07:50.691745Z,742,1,"the final point be the relationship between the Research and Education Committee and the various instrument of the Common Market regulation which , for the sake of accuracy , I have before I .they cover 1,500 matter affect agriculture .I have turn up those on sugar .it occur to I to ask whether the Government have relate the requirement of the order with the bureaucracy which be to be impose upon we .it be no use involve we in lengthy speech about the value of a sugar beet order when , at the same time , the Government publish a Bill which intend to put the control of the sugar industry so much into the hand of bureaucrat in Brussels .",2021-03-22T16:07:50.691815Z,1
,0,2021-03-22T16:08:01.900316Z,743,3,I think it be perfectly healthy for this House to be suspicious of excessive bureaucracy .,2021-03-22T16:08:01.900377Z,1
,0,2021-03-22T16:08:21.058760Z,744,1,"what be certain be that it be not public ownership in the sense in which we use the expression in this House , even if at the time of a General Election it become rather broad in meaning .but it be part of a huge State bureaucracy , and although we on this side of the House agree with the Home Secretary that there be a place for a totalisator board along the line of the organisation set up originally by a Private Member 's Bill in 1928 and , for that reason , we shall not oppose the Bill 's Second Reading , that do not mean that we do not have grave doubt about important part .of the Bill .we shall try to improve ' the Bill in Committee .that will be the tone of our discussion .",2021-03-22T16:08:21.058803Z,1
,0,2021-03-22T16:08:31.693485Z,745,5,"one matter which be of urgent importance to the people of this country be that the House of Commons should be able to discuss the agricultural contribution .I ask the Government — this be well within their sphere of influence — to consider how so to arrange the procedure of the House that those matter which appear to be no long the responsibility of Ministers but of the Commission can be debate in the House both on Opposition day — which use to be call Supply day — and also on the Consolidated Fund Bill .I have no doubt that on many occasion , if we enter the European Community , we shall wish to complain about the bureaucracy of Brussels and its damaging effect on the interest of our constituent .",2021-03-22T16:08:31.693514Z,1
,0,2021-03-22T16:08:45.282840Z,746,1,"television company largely put together their programme schedule ponderously and far in advance , with enormous capital outlay and ample opportunity for the labyrinthine bureaucracy of the Authority to examine and decide , if it wish to decide , the meritorious nature or otherwise of the programme .but , as the ex - pirate from Brighouse and Spenborough and other have remark , radio be much free and easy and fast , and there be much more instant broadcasting , so there will not be that amount of application to the Authority , which will not be able to seek out merit and insist upon it , at least in advance , although it may have something to say ex poste facto about it in the way it have theoretically be able to do in the case of television .",2021-03-22T16:08:45.282921Z,1
,0,2021-03-22T16:09:00.984966Z,747,6,"it would be interesting to know whether the Treasury , which have all along be say that one of the great advantage of a single rate system be the reduction in the number of civil servant who would be need compare with a multiple rate system , have make any calculation of the extra number of civil servant who will be need to operate the various type of multiple rate system .we have have the bland assertion time after time that if we go for more than one rate , ignore zero - rating , we could greatly increase administrative cost , particularly in the bureaucracy .however , we have not have any figure give to we .",2021-03-22T16:09:00.985119Z,1
,0,2021-03-22T16:09:14.473313Z,748,1,"""""""I remember get into trouble from one hon .member because I dare to say that civil servant in Brussels be run around like cockroach .what about the saving here , and the danger of a bureaucracy and the failure to have a check ?these be important matter .I say to member of the farming community , """""""" the consumer will be affect ; but , make no mistake , you could be affect , too . """"""""after all , people be eat less .the recent national food survey show that that be so .many of the low income group be now buy less food and cheap food , mince instead of other product .no doubt the Minister will be call the Minister for Mince .I be not deny that it be good meat , but mince be be buy instead of good red meat .there have undoubtedly be a saving .""""""",2021-03-22T16:09:14.473349Z,1
,0,2021-03-22T16:09:27.314736Z,749,7,"in this modern world , there be great talk of devolution , of more responsibility be place on individual .this be a very important political matter .it be a wide matter which we could discuss at great length .I shall not pursue it too far .however , if we be to have partnership with industry and if we be to enable our ordinary citizen to feel that they be part of government , we must create a body of the kind we propose .there be a great danger that Britain will be subject to decision of a bureaucracy without adequate parliamentary scrutiny or check .it be reasonable that in the Bill some machinery should be create which would enable the House of Commons and industry connect with agriculture and food to have their say and convey their view adequately to our Minister , who , after all , will be on the Council of Ministers and here , too , will be responsible for the new policy which will emerge in Europe .",2021-03-22T16:09:27.314792Z,1
,0,2021-03-22T16:10:37.712201Z,750,2,"we believe that when it deal with large sum of money and affect the life of the people then we have the right to have a say .perhaps hon .and right hon .gentleman opposite do not accept this , but this be what we be try to achieve .they should not bring forward this kind of argument and ask a junior Minister to present it .the Government say that the advisory board we propose be too wide and would have insufficient knowledge .have the right hon .Gentleman never hear of a staff of expert to advise an advisory board ?why not draw upon that ?be it because he be put so many civil servant into the intervention Board that there will be none leave ?someone ask early about the number involve in the board .we have be tell that there will be 200 in the board headquarters at read alone .this be another bureaucracy .they should not come forward to we with nonsense about inflexibility and bureaucracy because it be they who be introduce this — a government who be elect to cut back the Civil Service .",2021-03-22T16:10:37.712235Z,1
,0,2021-03-22T16:10:50.500794Z,751,1,"before he depart to go on television tonight , my hon .friend the Member for Bassetlaw ( Mr. Ashton ) make great play of the argument that the presence of television camera would gravely alter our proceeding .but there be selection already , selection as between one Member and another , gravely damage for some of we , which go on because of what Aneurin Bevan call the ipse dixit of the television bureaucracy — choose the hon .member for Chelmsford ( Mr. St. John - Stevas ) or my hon .friend the Member for Bassetlaw to go on television instead of other hon .member who have make worthwhile contribution in the debate today .",2021-03-22T16:10:50.500839Z,1
,0,2021-03-22T16:11:00.701684Z,752,3,"be not the delay experience by people seek repatriation and help for repatriation absolutely inordinate , and be not the bureaucracy involve far too extensive ?",2021-03-22T16:11:00.701728Z,1
,0,2021-03-22T16:11:16.863030Z,753,2,"we listen to those whom we consult and decide that the balance lie with continue the levy as a pressure for good training .equally , as my right hon .friend say , we think it right to modify the system to make it simple for everybody , to make it relevant to individual firm and operative in a way which eliminate bureaucracy , form - filling and time - wasting and , in particular , the burden upon firm which have be consistently concerned to carry out good training accord to their need , and there have be many of these .",2021-03-22T16:11:16.863067Z,1
