annotation_approver,comment_count,created_at,id,label,text,updated_at,user
,0,2021-03-22T11:44:49.939249Z,594,1,"it be for that reason , in the general interest of his constituent in rural area , that this procedure be put there .I assure he that it be operate in the most sympathetic and understanding way possible and be certainly not intend as an additional piece of bureaucracy .I regret that in the remain second I be not able to reply to my hon .Frend 's other point , but I will gladly do so in a letter to he as soon as I can .",2021-03-22T11:44:49.939282Z,1
,0,2021-03-22T11:45:10.743428Z,595,2,"I be sure there be no lazy bureaucracy associate with my right hon .friend 's measure .I rise at this late hour only for a moment to defend as vigorously as I be able the very constructive proposal contain in the Clause .it be a matter of considerable interest to my constituency .large acreage of western Worcestershire be devoted to hop , and mine be the second large hop - grow constituency in the country , the large being in Kent .",2021-03-22T11:45:10.743475Z,1
,0,2021-03-22T11:45:36.570556Z,596,3,"I have see that sort of thing in large - scale industry , where small body of man dispose of matter hand to they .this be hand over the whole machinery of the State to bureaucracy in its bad form .Most people dislike bureaucracy — that be quite natural because we all object to be govern and to the spread of bureaucratic power — but the Government seem to be give an extraordinary amount of power to this small committee .the President of the Board of Trade do not deal with this aspect of the matter .will this committee be able to act without be responsible to the House ?can it take action without further reference to the President of the Board of Trade ?",2021-03-22T11:45:36.570590Z,1
,0,2021-03-22T11:46:17.251616Z,597,5,"the Prime Minister 's letter advanced argument which I have long accept .the good comment upon they have come from the Times , which say : the Prime Minister be assuredly right to reject the policy of ' parity with Scotland , ' and to concentrate instead on the administrative co - ordination of economic development in Wales .Wales have half the population of Scotland and it do not have distinct system of law , administration of justice , land tenure , and local government , which be the administrative justification of a separate Scottish Office , with very often separate legislation to apply .the sense of nationhood which Welshmen share be acknowledge and respect in other part of the British Isles .but it need neither political nor administrative separatism to give it mean of expression , as the history of the past few hundred year bear witness .it can hardly be in the good interest of the Welsh people to saddle the country with a semi - autonomous bureaucracy which would he justify neither by scale nor function , even if it be Wales 's own .in the last resort , it be the taxpayer who have to pay and the ordinary citizen who have to suffer from any excess or deficiency of bureaucracy .",2021-03-22T11:46:17.251710Z,1
,0,2021-03-22T11:47:00.668397Z,598,5,"moreover , I think that the practice that we often follow of send constituent ' letter to Ministers tend to encourage the citizen to ignore the avenue of redress which this House have put there for the protection of the citizen against the power of bureaucracy .I think that we sometimes encourage irresponsibility and encourage person to ignore the proper channel for express their grievance .we should discourage citizen from use member of Parliament as channel of communication to Ministers when they have proper approach through recognise machinery of appeal or otherwise .",2021-03-22T11:47:00.668433Z,1
,0,2021-03-22T11:47:08.904181Z,599,3,"— a bureaucracy ; I thank my hon .friend .it would not be unfair of we to say that the Bill be load with the power of bureaucracy , but we have not do so .but hon .member opposite do not bring that fairness into their argument at General Elections .",2021-03-22T11:47:08.904232Z,1
,0,2021-03-22T11:47:46.786543Z,600,4,"the other argument advance be the argument of monopoly .I seem to spend my life in quote the hon .Member for North Angus and Mearns ( Sir C. Thornton - Kemsley ) when he be not in the House .I do not know why he be never here when I want to quote he , but the hon .Member speak about the danger of monopoly .how be it intend to overcome the danger of monopoly ?in place of twelve popularly elect council , there be to be one appoint , irresponsible state bureaucracy .I do not want to quarrel with my hon .friend the Member for Acton ( Mr. Sparks ) by get out of order and talk about the municipalisation of local house , but if there be any message from the Government 's policy about the control of rent property it be that they ought not to be give over to the control of local authority but to a State housing board .",2021-03-22T11:47:46.786600Z,1
,0,2021-03-22T11:48:05.715376Z,601,1,"my right hon .friend the Member for Flint , West also make it quite clear in the remark he address to this particular aspect of the matter , when he say that the suggestion to cover a long period ahead be merely a matter of convenience .I be not concerned with the convenience of the bureaucracy or anybody else .I be concerned with the proper application and utilisation of capital resource which be exceedingly scarce .there be no great protagonist in the House of Commons or elsewhere than I be of the need for further and continue expansion of electricity resource for industrial production and productivity , for enlargement of farm output , for commercial purpose , and for labour saving , cleanliness and efficiency in the home .they be all very desirable purpose , but to provide the financial sinew for they be extremely expensive , as I demonstrate a few moment ago , and our primary concern ought to be the correct application of capital and its most efficient use .",2021-03-22T11:48:05.715490Z,1
,0,2021-03-22T11:48:17.645602Z,602,1,"I know that all my hon .friend would join in the tribute pay by hon .member opposite to these great civil servant .what be wrong be not bureaucracy .I doubt whether there be anything like the old evil of bureaucracy in this great Ministry .what be wrong lie in the line , the figure and the norm draw up by Parliament .what be wrong be the basic minimum standard that we fix , below which no one shall go .",2021-03-22T11:48:17.645633Z,1
,0,2021-03-22T11:48:26.217618Z,603,5,"the answer be that the Minister can be call to account in the House of Commons as to whom he do or do not designate .he can be ask question about it .the real , substantial question raise by the Clause be whether the treatment of these people be to be leave to the autocratic bureaucracy of the right hon .Gentleman , or his successor , or whether he or his successor be to be answerable to the House about what be do in relation to these people .that be the effect of the Clause .",2021-03-22T11:48:26.217673Z,1
,0,2021-03-22T11:48:55.491618Z,604,2,"who make these regulation — Moses ?whilst it might be quite reasonable for a regular soldier , surely it be an absurd piece of bureaucracy to require a Territorial to alter his facial arrangement for a fortnight 's camp ?",2021-03-22T11:48:55.491662Z,1
,0,2021-03-22T11:49:13.589764Z,605,1,"the bureaucracy within the Treasury lead it to the conclusion enunciate this evening by the Economic Secretary , namely , that evidently a lawn mower , to be a lawn mower , must have a width of less than 18 inch if it be to be use for domestic purpose .there be appliance and tool have a width of less than 18 inch which be design specifically in such a fashion as to make it impossible for they to cut the short grass on a lawn .they be extensively use in orchard by horticulturist in the Vale of Evesham , in the Teyn Valley , in other agricultural area of the United Kingdom , by county council and by those responsible for operate cemetery , for example , where long grass be a serious consideration .",2021-03-22T11:49:13.589813Z,1
,0,2021-03-22T11:49:25.040483Z,606,4,"""""""the Gardiner Commission go on to try to analyse some of the reason for this situation .it give three main reason , to be find in deeply root feature of the adult world .first , the whole trend of our society be towards centralisation and bureaucratisation .these have become feature of voluntary body just as they be of industrial and governmental organisation .all the thing that be associate with bureaucracy — that it be cautious , slow , compromising and impersonal — be profoundly hostile to the mood of youth .secondly , a major element in the estrangement of the young … be the feeling that society itself and most of its institution be still run by people of different outlook and class background .thirdly """""""" — — and perhaps most fundamental in my view , the Gardiner Report suggest that — our nation provide no clear or inspiring objective to arouse the latent idealism of the young .apart from ' get on , ' the major message that the adult society transmit to youth be the necessity to consume .not only be personal consumption present as in itself the most important goal of human endeavour but as the outward and visible sign of personal success .vast resource of cash and persuasive talent be today mobilise to educate the young as consumer .virtually nothing be do to awaken they to the task and challenge of a democratic society .I be sorry to have quote at such length , but I be very glad that my hon .friend , in open the debate , refer both to this document and to the other document """""""" leisure for live """""""" , which we in the Labour Party produce shortly before the election — rather too shortly before , I be afraid .I must congratulate our opposite number in the Conservative Party on get their document through the printer rather more quickly than we be able to do because of the dispute , and also , of course , on the almost telepathic similarity of some of their proposal — even to the actual phrase — to our own proposal which appear only a few day afterwards .if it be true that great mind think alike , and if these proposal be acceptable to hon .member on both side of the House , so much the well .there will be some hope that they may be carry out by the present government .I myself , at any rate , feel that both the Report of the Gardiner Commission and our own document """""""" leisure for live """""""" have somewhat more permanent value than , shall I say , the average ephemeral election throwaway .""""""",2021-03-22T11:49:25.040534Z,1
,0,2021-03-22T11:50:04.586033Z,606,2,"""""""the Gardiner Commission go on to try to analyse some of the reason for this situation .it give three main reason , to be find in deeply root feature of the adult world .first , the whole trend of our society be towards centralisation and bureaucratisation .these have become feature of voluntary body just as they be of industrial and governmental organisation .all the thing that be associate with bureaucracy — that it be cautious , slow , compromising and impersonal — be profoundly hostile to the mood of youth .secondly , a major element in the estrangement of the young … be the feeling that society itself and most of its institution be still run by people of different outlook and class background .thirdly """""""" — — and perhaps most fundamental in my view , the Gardiner Report suggest that — our nation provide no clear or inspiring objective to arouse the latent idealism of the young .apart from ' get on , ' the major message that the adult society transmit to youth be the necessity to consume .not only be personal consumption present as in itself the most important goal of human endeavour but as the outward and visible sign of personal success .vast resource of cash and persuasive talent be today mobilise to educate the young as consumer .virtually nothing be do to awaken they to the task and challenge of a democratic society .I be sorry to have quote at such length , but I be very glad that my hon .friend , in open the debate , refer both to this document and to the other document """""""" leisure for live """""""" , which we in the Labour Party produce shortly before the election — rather too shortly before , I be afraid .I must congratulate our opposite number in the Conservative Party on get their document through the printer rather more quickly than we be able to do because of the dispute , and also , of course , on the almost telepathic similarity of some of their proposal — even to the actual phrase — to our own proposal which appear only a few day afterwards .if it be true that great mind think alike , and if these proposal be acceptable to hon .member on both side of the House , so much the well .there will be some hope that they may be carry out by the present government .I myself , at any rate , feel that both the Report of the Gardiner Commission and our own document """""""" leisure for live """""""" have somewhat more permanent value than , shall I say , the average ephemeral election throwaway .""""""",2021-03-22T11:50:04.586127Z,1
,0,2021-03-22T11:50:13.225877Z,607,1,"""""""I wish to know whether the present position will still obtain .if not , be that why the Minister refuse to give the list and why Parliament be be ignore ?I beg hon .member opposite not to dismiss this matter lightly ; not to be """""""" Lobby fodder """""""" .after all , they inveigh so often against the Labour Government and say that we be create bureaucracy .here be an opportunity to resist bureaucracy , not to strengthen the Executive and weaken local initiative and organisation in area like my own .I wish that the noble Lord the Member for Dorset , South ( Viscount Hinchingbrooke ) be still in the Chamber , because if he be sincere in what he say early he would support the Amendment .""""""",2021-03-22T11:50:13.225939Z,1
,0,2021-03-22T11:50:15.658220Z,607,3,"""""""I wish to know whether the present position will still obtain .if not , be that why the Minister refuse to give the list and why Parliament be be ignore ?I beg hon .member opposite not to dismiss this matter lightly ; not to be """""""" Lobby fodder """""""" .after all , they inveigh so often against the Labour Government and say that we be create bureaucracy .here be an opportunity to resist bureaucracy , not to strengthen the Executive and weaken local initiative and organisation in area like my own .I wish that the noble Lord the Member for Dorset , South ( Viscount Hinchingbrooke ) be still in the Chamber , because if he be sincere in what he say early he would support the Amendment .""""""",2021-03-22T11:50:15.658269Z,1
,0,2021-03-22T11:50:26.388872Z,608,1,"this underline the fact that although we be set out a Free Trade Area for the Seven , the first document which this House be ask to approve actually complicate trading and enlarge the bureaucracy connect with the Customs .of course , it be only a small extension for this country because so much of our trade be already affect in this way .whether the other country of the Seven will be as unmoved when they find out by experience the complication in the working of certificate of origin I doubt .",2021-03-22T11:50:26.388908Z,1
,0,2021-03-22T11:50:38.154025Z,609,1,"would my hon .and learn Friend not agree that such a consistent application of the law , as he call it , without use commonsense method or consider the whole question of humanity be , in fact , bureaucracy ?",2021-03-22T11:50:38.154120Z,1
,0,2021-03-22T11:50:48.011855Z,610,1,"I think that the West Berlin people be entitle to be rather sure than they be at the moment that , for instance , their export trade , on which they depend , be not hold up by what be nothing more than sheer bureaucracy on the part of the Russians or East Berlin official , whichever they may be .",2021-03-22T11:50:48.011886Z,1
,0,2021-03-22T11:50:55.421163Z,611,5,surely the protection which farmer will have from the wisdom — to put it no higher — of the general commissioner for their area will be enough to safeguard they from injustice or bureaucracy .we regard the amendment more with suspicion than with approval .,2021-03-22T11:50:55.421222Z,1
,0,2021-03-22T11:51:07.352076Z,612,1,"I have already complain about Ministers come to the House and be the mouthpiece of the bureaucracy .in this case , I honestly believe that the Minister have not the slight idea of what be happen in his Department .it might be ask what evidence there be to support that .the hon .and gallant Member for the Isle of Ely ( Sir H. Legge - Bourke ) will remember that time and again we discuss the difficulty of an assessment base on Schedule A.time and again the Government defend the attitude they have adopt .",2021-03-22T11:51:07.352110Z,1
,0,2021-03-22T11:51:19.977415Z,613,7,"the Minister also say that acceptance of the Amendments would add another complication .I know that bureaucracy be always anxious , if it can , to simplify matter at the expense of the public , but the duty of Parliament be to prevent that , and to place a precise limit on any invasion of or interference with the ordinary right of privacy , particularly with regard to entry on to land and private premise .",2021-03-22T11:51:19.977458Z,1
,0,2021-03-22T11:51:26.044996Z,614,5,"we be all deeply conscious of the danger which at present threaten individual in deal with bureaucracy .it be not only extraordinarily unconvincing , but politically singularly inapt for the junior Minister to have reject the Amendment .the Amendment can not do any harm .at its very bad , it may not be wholly adequate .if he find that be so , then he can easily have an Amendment move in another place , and if , on examination , that Amendment seem an improvement , we should not raise any objection when it be bring back to we from another place .",2021-03-22T11:51:26.045029Z,1
,0,2021-03-22T11:51:53.175917Z,615,2,"the hon .member for Widnes ( Mr. MacColl ) have courteously give I something like four minute in which to deal with his motion .I should like to start by say straight away that the Government recognise their responsibility for make sure that by one mean or another there shall be enough site for the rehousing of those member of the population in the big city who be at present live under bad condition .the Government have accept that responsibility .my right hon .friend have say categorically on several occasion that the Government do not intend that rehousing shall falter for lack of land , and , of course , there be the great collaboration between the various Departments of the Government in secure this .if all the Departments concern be to be merge together , there would be one titanic bureaucracy which would not be nearly as effective as the present system of close collaboration between all Departments concern stimulate by my right hon .friend and his contact with the local authority .",2021-03-22T11:51:53.175956Z,1
,0,2021-03-22T11:51:55.627957Z,615,3,"the hon .member for Widnes ( Mr. MacColl ) have courteously give I something like four minute in which to deal with his motion .I should like to start by say straight away that the Government recognise their responsibility for make sure that by one mean or another there shall be enough site for the rehousing of those member of the population in the big city who be at present live under bad condition .the Government have accept that responsibility .my right hon .friend have say categorically on several occasion that the Government do not intend that rehousing shall falter for lack of land , and , of course , there be the great collaboration between the various Departments of the Government in secure this .if all the Departments concern be to be merge together , there would be one titanic bureaucracy which would not be nearly as effective as the present system of close collaboration between all Departments concern stimulate by my right hon .friend and his contact with the local authority .",2021-03-22T11:51:55.627990Z,1
,0,2021-03-22T11:53:33.826428Z,616,2,"the Economic Secretary have give no justification for his case whatsoever .it be quite clear that there be some bumble - dom in the Board of Customs and Excise .I be sorry to say this , because most of we have very high regard for that Department as an operational unit , but , somewhere down the line in the Board of Customs and Excise , there be this bumble bureaucracy which , on this occasion , and despite his acceptance of the fact that there be an anomaly here , have convince the hon .gentleman that this change can not he make .",2021-03-22T11:53:33.826467Z,1
,0,2021-03-22T11:53:48.373189Z,617,5,"consider the size of this undertaking .the Commission , when we have bring it into existence and complete the process of transfer , will own about 90,000 dwelling , in which dwell about 350,000 people .it will own about 250 factory and 2,000 shop .when we debate land , a few day ago , the Minister be very critical of certain proposal that we make on the ground that they would lead to an enormous bureaucracy .but surely it be an extraordinary measure of bureaucracy that this varied range of undertaking , the proper administration of which require so much local knowledge peculiar to each particular town , should all be handle by a single nominate Commission ?",2021-03-22T11:53:48.373225Z,1
,0,2021-03-22T11:53:50.749825Z,617,3,"consider the size of this undertaking .the Commission , when we have bring it into existence and complete the process of transfer , will own about 90,000 dwelling , in which dwell about 350,000 people .it will own about 250 factory and 2,000 shop .when we debate land , a few day ago , the Minister be very critical of certain proposal that we make on the ground that they would lead to an enormous bureaucracy .but surely it be an extraordinary measure of bureaucracy that this varied range of undertaking , the proper administration of which require so much local knowledge peculiar to each particular town , should all be handle by a single nominate Commission ?",2021-03-22T11:53:50.749865Z,1
,0,2021-03-22T11:53:57.442342Z,618,7,"we know that the Executive and the bureaucracy always have a natural resistance to parliamentary scrutiny .the first point that be feel widely , not only on this side of the Committee , be that , as one hon .member opposite say , the Bill be admit to be grossly unfair .that be indisputable .this measure victimise a small number of man who be , in a sense , be double - crossed .",2021-03-22T11:53:57.442369Z,1
,0,2021-03-22T11:54:39.430255Z,619,3,"on this matter of test consumer good and issue seal of approval , there be , as he know , a somewhat different approach between we .this , of course , be our difficulty , because , strange as it may seem to all political commentator who try falsely to persuade the public that the Socialist Party stand for great , massive , state bureaucracy , which of course , be perfectly untrue , the hon .Member be try in this Bill to give we a far more bureaucratic method of deal with this problem than we ourselves approve in our own policy statement .I appreciate his difficulty and that be why I be support his Bill , because the machinery which both of we would like to have set up be not here .",2021-03-22T11:54:39.430288Z,1
,0,2021-03-22T11:54:57.323686Z,620,1,"those of we who have be in Washington recently , and have try to hack our way through part of that strange jungle of lobby and bureaucracy , know something of the intense pressure to which President Kennedy be subject by various interest .in particular , a vast industrial - military vested interest have grow up in the missile industry .this interest would be threaten by a real test ban .new sale depend on new model : new model depend on new test .it be regrettable , indeed shameful , that the Prime Minister of Great Britain should feel oblige to yield indirectly to these same pressure , and should so feebly echo his master 's voice .",2021-03-22T11:54:57.323729Z,1
,0,2021-03-22T11:55:13.022445Z,621,3,"if my hon .friend believe that , he will believe anything .he can take it from I that a doctor , act with a secretary , can collect debt much quick and much more cheaply than can a hospital employ a large staff .there be no doubt that an individual collect his own debt be much quick on the ball .he get the money in more cheaply .I think I take the whole House with I on that .once a bureaucracy be engage it be difficult .what the doctor receive be not know .but a calculation base on accident statistic suggest that the gross figure be also in the region of £ 100,000 a year .I believe that the cost of collection be very much less —",2021-03-22T11:55:13.022514Z,1
,0,2021-03-22T11:55:14.696680Z,621,5,"if my hon .friend believe that , he will believe anything .he can take it from I that a doctor , act with a secretary , can collect debt much quick and much more cheaply than can a hospital employ a large staff .there be no doubt that an individual collect his own debt be much quick on the ball .he get the money in more cheaply .I think I take the whole House with I on that .once a bureaucracy be engage it be difficult .what the doctor receive be not know .but a calculation base on accident statistic suggest that the gross figure be also in the region of £ 100,000 a year .I believe that the cost of collection be very much less —",2021-03-22T11:55:14.696740Z,1
